{
  "adb_version": "Android Debug Bridge version 1.0.41\nVersion 37.0.0-14910828\nInstalled as /Users/luwentao/Library/Android/sdk/platform-tools/adb\nRunning on Darwin 25.4.0 (arm64)",
  "collected_at": "2026-08-24T08:01:47.097465+00:00",
  "connection": "already connected to EP0110PZ0B9110300B",
  "device": {
    "abi": "arm64-v8a",
    "adb_serial": "EP0110PZ0B9110300B",
    "android_release": "16",
    "build_fingerprint": "nubia/pacific/pacific:16/BQ2A.250705.001-BP2A.250605.031.A3/20260306.003030:userdebug/test-keys",
    "device": "pacific",
    "device_serial": "EP0110PZ0B9110300B",
    "manufacturer": "nubia",
    "model": "P0110",
    "product": "pacific",
    "sdk": 36
  },
  "kind": "android_device_info",
  "packages": [
    {
      "package": "dev.telemachus.display",
      "version_code": 100000,
      "version_name": "0.0.0"
    }
  ],
  "schema_version": "vibescreen.evidence/v1"
}
